title,start_date,end_date,place,cast,runtime,age,tickets,story,genre,prstate,time
"정동화, 20주년 단독 콘서트",2023.06.28,2023.06.29,2023.06.29,정동화,2시간,만 7세 이상,"R석 88,000원, S석 66,000원",,뮤지컬,공연완료,수요일 ~ 목요일(20:00)
미니특공대: 브이레인저스  [서울(앵콜)],2023.07.08,2023.07.16,2023.07.16,"조남규 , 김재범, 안혜란, 정세록, 김가람, 홍성혁, 송영훈 등",1시간 5분,24개월 이상,"VIP석 70,000원, R석 60,000원, S석 50,000원",,뮤지컬,공연완료,"화요일 ~ 금요일(11:00,14:00), 토요일(11:00,14:00,17:00), 일요일(11:00,14:00)"
맘마미아! [대전],2023.06.30,2023.07.02,2023.07.02,"최정원, 신영숙, 김환희, 최태이, 김영주, 홍지민, 박준면 등",2시간 40분,만 7세 이상,"VIP석 150,000원, R석 130,000원, S석 90,000원, A석 70,000원",,뮤지컬,공연완료,"금요일(19:30), 토요일 ~ 일요일(14:00,19:00)"
맘마미아! [인천],2023.07.07,2023.07.09,2023.07.09,"최정원, 신영숙, 김환희, 최태이, 홍지민, 김영주, 박준면 등",2시간 40분,만 7세 이상,"VIP석 150,000원, R석 130,000원, S석 90,000원, A석 70,000원",,뮤지컬,공연완료,"금요일(19:30), 토요일(14:00,19:00), 일요일(14:00)"
맘마미아! [용인],2023.07.28,2023.07.30,2023.07.30,"최정원, 신영숙, 김환희, 최태이, 김영주, 홍지민, 박준면 등",2시간 40분,만 7세 이상,"VIP석 150,000원, R석 130,000원, S석 90,000원",,뮤지컬,공연완료,"금요일(19:30), 토요일(14:00,19:00), 일요일(14:00)"
멤피스,2023.07.20,2023.10.22,2023.10.22,"박강현, 고은성, 이창섭, 정선아, 유리아, 손승연, 최민철 등",2시간 30분,만 13세 이상,"VIP석 160,000원, R석 130,000원, S석 100,000원, A석 70,000원",,뮤지컬,공연완료,"화요일 ~ 목요일(19:30), 금요일(14:30,19:30), 토요일(14:00,19:00), 일요일(14:00,19:00)"
"태권, 날아올라",2023.07.14,2023.08.27,2023.08.27,"임동섭, 김진태, 전우태, 김종년, 권민수, 엄지민, 김용호 등",1시간 10분,48개월 이상,"VIP석 77,000원, R석 66,000원, S석 44,000원",,뮤지컬,공연완료,"화요일 ~ 금요일(11:00,14:00,19:30), 토요일(11:00,14:00,17:00), 일요일(11:00,14:00,17:00), HOL(11:00,14:00)"
멸화군,2023.06.23,2023.08.11,2023.08.11,"최재웅, 김민성, 이석준, 안유진, 김청아, 강동우, 구준모 등",2시간 15분,만 7세 이상,"R석 88,000원, S석 66,000원, A석 44,000원",,뮤지컬,공연완료,"화요일 ~ 금요일(20:00), 토요일(15:00,19:00), 일요일(14:00,18:00)"
오페라의 유령 [서울],2023.07.21,2023.11.19,2023.11.19,"조승우, 최재림, 김주택, 전동석, 손지수, 송은혜, 송원근 등",2시간 30분,만 7세 이상,"VIP석 190,000원, R석 160,000원, S석 130,000원, A석 90,000원",,뮤지컬,공연완료,"화요일 ~ 금요일(14:30,19:30), 토요일 ~ 일요일(14:00,15:00,19:00), HOL(14:00,15:00,19:00)"
와일드 그레이,2023.06.08,2023.09.03,2023.09.03,"박민성, 김경수, 정재환, 김리현, 윤석호, 기세중, 안지환 등",1시간 50분,만 15세 이상,"R석 66,000원, S석 44,000원",,뮤지컬,공연완료,"화요일(20:00), 수요일(16:00,20:00), 목요일 ~ 금요일(20:00), 토요일(15:00,19:00), 일요일(14:00,18:00)"
더 픽션,2023.06.24,2023.09.17,2023.09.17,"김도빈, 유승현, 김준영, 박유덕, 주민진, 정동화, 최호승 등",1시간 30분,만 13세 이상,"R석 66,000원, S석 44,000원",,뮤지컬,공연완료,"화요일(20:00), 수요일(16:00,20:00), 목요일 ~ 금요일(20:00), 토요일(15:00,19:00), 일요일(14:00,18:00)"
백작 [대학로],2023.06.05,2023.08.27,2023.08.27,"이승현, 박규원, 이진혁, 김지온, 권태하, 조성필 등",1시간 30분,만 12세 이상,"R석 66,000원, S석 44,000원",,뮤지컬,공연완료,"월요일 ~ 금요일(20:00), 토요일(15:00,19:00), 일요일(14:00,18:00)"
드림스쿨,2023.05.13,2023.08.27,2023.08.27,"김동훈, 차강석, 진예원, 윤여정, 임진혁, 여정민, 유예진 등",1시간 20분,만 7세 이상,"R석 60,000원, S석 50,000원",,뮤지컬,공연완료,"목요일(19:00), 토요일 ~ 일요일(18:30), HOL(18:30)"
그날들,2023.07.12,2023.09.03,2023.09.03,"유준상, 이건명, 오만석, 엄기준, 오종혁, 지창욱, 김지현 등",2시간 45분,만 7세 이상,"OP석 160,000원, R석 160,000원, S석 130,000원, A석 100,000원, B석 70,000원, C석 50,000원",,뮤지컬,공연완료,"화요일(19:30), 수요일(14:30,19:30), 목요일 ~ 금요일(19:30), 토요일 ~ 일요일(14:00,19:00), HOL(14:00,19:00)"
수레바퀴 아래서,2023.06.13,2023.08.20,2023.08.20,"박새힘, 주다온, 유소리, 송영미, 이서영, 유낙원, 조은진 등",1시간 30분,만 7세 이상,"시야제한석 50,000원, R석 65,000원",,뮤지컬,공연완료,"목요일 ~ 금요일(20:00), 토요일(15:00,19:00), 일요일(14:00,18:00), 수요일(16:00,20:00), 화요일(20:00)"
라흐 헤스트,2023.06.13,2023.09.03,2023.09.03,"이지숙, 최수진, 김종구, 윤석원, 박영수, 임찬민, 김주연 등",1시간 40분,만 13세 이상,"R석 66,000원, S석 44,000원",,뮤지컬,공연완료,"화요일 ~ 금요일(20:00), 토요일(15:00,19:00), 일요일(14:00,18:00)"
알쏭달쏭 캐치! 티니핑: 신비한 상자를 열어라! [창원],2023.07.08,2023.07.09,2023.07.09,"채 현, 김리아, 이정훈, 문이보, 김선형, 이아영, 공귀경 등",1시간 10분,24개월 이상,"R석 66,000원, S석 44,000원",,뮤지컬,공연완료,"토요일 ~ 일요일(11:00,14:00,16:30)"
모차르트!,2023.06.15,2023.08.22,2023.08.22,"이해준, 유회승, 김희재, 허혜진, 황우림, 민영기, 서범석 등",2시간 55분,만 7세 이상,"VIP석 170,000원, R석 140,000원, S석 110,000원, A석 90,000원, B석 70,000원",,뮤지컬,공연완료,"화요일(19:30), 수요일(14:30,19:30), 목요일(19:30), 금요일(14:30,19:30), 토요일(14:30,19:30), HOL(14:30,19:30), 일요일(15:00)"
왕자대전,2023.06.01,2023.09.03,2023.09.03,"박상돈, 곽동현, 최인형, 장대성, 최민우, 박근식, 민시윤 등",1시간 40분,만 7세 이상,"R석 66,000원, S석 55,000원",,뮤지컬,공연완료,"화요일 ~ 금요일(20:00), 토요일 ~ 일요일(14:00,18:00)"
알쏭달쏭 캐치! 티니핑: 신비한 상자를 열어라! [성남],2023.07.15,2023.07.16,2023.07.16,"채 현, 김리아, 이정훈, 문이보, 김선형, 이아영, 공귀경 등",1시간 10분,24개월 이상,"R석 66,000원, S석 44,000원",,뮤지컬,공연완료,"토요일 ~ 일요일(11:00,14:00,16:30)"
"아르토,고흐",2023.06.04,2023.08.27,2023.08.27,"유승현, 안재영, 양지원, 조풍래, 김준영, 박좌헌, 임병근 등",1시간 40분,만 13세 이상,"R석 66,000원, S석 44,000원",,뮤지컬,공연완료,"화요일 ~ 금요일(20:00), 토요일(15:00,19:00), 일요일(14:00,18:00)"
알쏭달쏭 캐치! 티니핑: 신비한 상자를 열어라! [울산],2023.07.01,2023.07.02,2023.07.02,"이정훈, 문이보, 김선형, 이아영, 공귀경, 최현진, 최세인 등",1시간 10분,24개월 이상,"R석 66,000원, S석 44,000원",,뮤지컬,공연완료,"토요일 ~ 일요일(11:00,14:00,16:30)"
박정희: 내 무덤에 침을 뱉어라 [구미],2023.06.02,2023.06.03,2023.06.03,"신민호, 정다미, 김효선, 양동혁, 김성민, 유기호, 문지수 등",2시간 30분,만 14세 이상,"VIP석 70,000원, R석 50,000원, S석 30,000원",,뮤지컬,공연완료,"금요일(14:30,19:30), 토요일(14:30,19:30)"
알쏭달쏭 캐치! 티니핑: 신비한 상자를 열어라! [여수],2023.06.24,2023.06.25,2023.06.25,"채현, 김리아, 이정훈, 문이보, 김선형, 이아영, 공귀경 등",1시간 10분,24개월 이상,"R석 66,000원",,뮤지컬,공연완료,"토요일 ~ 일요일(11:00,14:00,16:30)"
영웅 [부산],2023.06.27,2023.07.02,2023.07.02,"정성화, 양준모, 민우혁, 김도형, 서영주, 최민철, 정재은 등",2시간 40분,만 7세 이상,"VIP석 150,000원, R석 130,000원, S석 110,000원, A석 90,000원, B석 70,000원",,뮤지컬,공연완료,"화요일 ~ 금요일(19:30), 토요일(14:00,18:30), 일요일(14:00)"
파리넬리 [부천],2023.06.23,2023.06.24,2023.06.24,"김경수, 박소연, 유성재, 김주호, 루이스 초이, 노희찬, 이한밀",2시간 30분,만 13세 이상,"R석 60,000원, S석 40,000원",,뮤지컬,공연완료,"금요일(19:30), 토요일(15:00)"
여신님이 보고계셔 [경기 광주],2023.06.16,2023.06.17,2023.06.17,"성태준, 김기택, 임진섭, 윤석원, 권동호, 한보라, 이동수 등",2시간,만 10세 이상,"R석 40,000원, S석 30,000원, A석 15,000원",,뮤지컬,공연완료,"금요일(19:30), 토요일(14:00,18:00)"
이상한 과자 가게 전천당 [서울(앵콜)],2023.06.30,2023.07.09,2023.07.09,"김혜정, 김이슬, 이나영, 임지온, 박정은, 류정훈, 손원근 등",1시간 10분,24개월 이상,"VIP석 70,000원, R석 60,000원",,뮤지컬,공연완료,"금요일(11:00), 토요일 ~ 일요일(11:00,14:00,16:30)"
WONDERLAND THEATRE,2023.05.06,2023.05.13,2023.05.13,"강홍석, 서경수, 정원영, 조형균, 김수하, 민경아, 정선아 등",2시간 30분,만 7세 이상,"R석 121,000원, S석 110,000원, A석 99,000원",,뮤지컬,공연완료,"토요일(19:00), 토요일(14:00)"
아리 아라리,2023.05.20,2023.05.31,2023.05.31,"조슬아, 계현욱, 김현영, 남현우, 양도선, 이정선, 한다연 등",1시간 10분,만 6세 이상,"R석 60,000원, S석 40,000원",,뮤지컬,공연완료,"화요일(19:30), 수요일(14:00), 목요일 ~ 금요일(19:30), 토요일(14:00,17:00), 일요일(14:00)"
"제17회 DIMF 창작지원작, 일기 쓰는 남자 [대구]",2023.05.19,2023.05.21,2023.05.21,"안덕용, 정휘욱, 신유진, 정혜은, 박소리, 유기호, 김태현 등",1시간 40분,만 13세 이상,"R석 40,000원, S석 20,000원",,뮤지컬,공연완료,"금요일(19:30), 토요일(15:00,19:00), 일요일(15:00)"
"제17회 DIMF 폐막작, 로자 바글라노바 [대구]",2023.06.02,2023.06.03,2023.06.03,"자리나 마키나, 아크마랄 아야쇼바, 아스카트 베이트루, 아이누 베르무캄베토바, 예르잔 아만타예프, 아루잔 베이토카노바, 아르누르 쿠드야르베크 등",1시간 40분,만 11세 이상,"VIP석 60,000원, R석 40,000원, S석 20,000원",,뮤지컬,공연완료,"금요일(19:30), 토요일(14:00)"
"제17회 DIMF 공식초청작, 비밀의 화원 [대구]",2023.06.02,2023.06.04,2023.06.04,"홍나현, 유낙원, 정백선, 박선영, 류 비, 박슬기",1시간 40분,만 7세 이상,"VIP석 60,000원, R석 30,000원, S석 20,000원",,뮤지컬,공연완료,"금요일(19:30), 토요일(15:00,19:00), 일요일(14:00,18:00)"
빨래 [부산],2023.06.17,2023.06.18,2023.06.18,"장혜민, 노희찬, 최정화, 양미경, 이승헌, 박준성, 박정민 등",2시간 40분,만 13세 이상,"R석 77,000원, S석 55,000원",,뮤지컬,공연완료,"토요일(14:00,18:00), 일요일(14:00)"
싯다르타 [대구],2023.05.12,2023.05.14,2023.05.14,"서도진, 이경수, 윤진웅, 송권웅, 김봄, 박수련, 최형석 등",2시간 30분,만 7세 이상,"VIP석 120,000원, R석 100,000원, S석 80,000원, A석 60,000원",,뮤지컬,공연완료,"금요일(15:00,19:30), 토요일(14:00,18:00), 일요일(14:00)"
더 테일 에이프릴 풀스,2023.06.07,2023.08.27,2023.08.27,"최석진, 현석준, 황순종, 주민진, 박정원, 손유동",1시간 30분,만 13세 이상,"R석 66,000원, S석 55,000원",,뮤지컬,공연완료,"화요일 ~ 금요일(20:00), HOL(14:00,18:00), 토요일 ~ 일요일(14:00,18:00)"
루쓰 [성남],2023.05.26,2023.05.28,2023.05.28,"정지아, 김다현, 이지훈, 엄태리, 정원영, 백승렬, 박인배 등",2시간 20분,만 7세 이상,"VIP석 150,000원, R석 130,000원, S석 90,000원, A석 70,000원",,뮤지컬,공연완료,"토요일(14:00,19:00), 일요일(14:00), 금요일(19:30)"
"제17회 DIMF 공식초청작 개막작, 나인 투 파이브 [대구]",2023.05.19,2023.05.28,2023.05.28,"레아 세인트 루스, 루신다 로렌스, 조지나 캐슬, 숀 니덤, 줄리아 네이글, 몰리 메이 가드너, 에밀리 불 등",2시간 20분,만 14세 이상,"VIP석 90,000원, R석 70,000원, S석 50,000원, A석 30,000원, B석 20,000원",,뮤지컬,공연완료,"화요일(15:00,19:30), 수요일(19:30), 목요일(15:00,19:30), 금요일(19:30), 토요일(15:00,19:30), 일요일(14:00,19:30)"
할란카운티,2023.05.16,2023.07.16,2023.07.16,"류정한, 안재욱, 이건명, 임태경, 이홍기, 박장현, 이병찬 등",2시간 40분,만 7세 이상,"VIP석 150,000원, R석 130,000원, S석 100,000원, A석 80,000원",,뮤지컬,공연완료,"월요일(14:00), 화요일 ~ 금요일(19:30), 토요일 ~ 일요일(14:00,18:30), HOL(14:00,18:30)"
나폴레옹 [서울],2023.05.05,2023.05.21,2023.05.21,"로랑 방, 존 아이젠, 치아나 디 바리, 타티아나 마트르, 크리스토프 세리노, 제롬 콜렛, 로망 프룩투오조 등",3시간,만 7세 이상,"VIP석 170,000원, R석 140,000원, S석 100,000원, A석 80,000원, B석 50,000원",,뮤지컬,공연완료,"화요일 ~ 금요일(20:00), 토요일 ~ 일요일(14:00,19:00)"
"Again, 여고동창생",2023.05.25,2023.06.11,2023.06.11,"박해미, 김완선, 황석정, 하은섬, 최수형, 우지원, 김재만 등",2시간,만 7세 이상,"R석 150,000원, S석 100,000원",,뮤지컬,공연완료,"목요일 ~ 금요일(19:30), 토요일(15:00,19:30), 일요일(15:00)"
영웅 [수원],2023.06.09,2023.06.11,2023.06.11,"정성화, 양준모, 민우혁, 김도형, 서영주, 최민철, 정재은 등",2시간 40분,만 7세 이상,"R석 150,000원, S석 130,000원, A석 90,000원, B석 70,000원",,뮤지컬,공연완료,"금요일(19:30), 토요일(14:00,18:30), 일요일(14:00)"
루드윅: 베토벤 더 피아노 [안산],2023.06.16,2023.06.17,2023.06.17,"백인태, 김준영, 인은율, 박이든, 조재철",1시간 50분,만 9세 이상,"R석 50,000원, S석 40,000원, A석 30,000원",,뮤지컬,공연완료,"금요일(10:20,19:30), 토요일(14:00)"
비스티,2023.05.16,2023.08.13,2023.08.13,"김종구, 정동화, 박규원, 정민, 조풍래, 김지온, 송상훈 등",2시간,만 13세 이상,"R석 77,000원, S석 55,000원",,뮤지컬,공연완료,"화요일(20:00), 수요일(16:00,20:00), 목요일 ~ 금요일(20:00), 토요일(15:00,19:00), 일요일(14:00,18:00)"
드림하이,2023.05.13,2023.07.23,2023.07.23,"음문석, 이승훈, 유태양, 박규리, 이재이, 표바하, 고창석 등",2시간,만 7세 이상,"VIP석 150,000원, R석 130,000원, S석 90,000원, A석 70,000원",,뮤지컬,공연완료,"화요일 ~ 금요일(19:30), 토요일 ~ 일요일(14:00,18:00,18:30), HOL(14:00,18:00,18:30)"
어린왕자 [대구],2023.05.04,2023.05.06,2023.05.06,"구주완, 백수민, 조성민, 백경빈, 박은솔, 이연주, 김치우 등",55분,36개월 이상,"R석 30,000원, S석 20,000원, A석 10,000원",,뮤지컬,공연완료,"목요일(11:00), HOL(14:00), 토요일(14:00)"
트레이스 유,2023.05.11,2023.08.20,2023.08.20,"김경수, 이 율, 장지후, 윤승우, 변희상, 유현석, 이종석 등",1시간 50분,만 13세 이상,"R석 70,000원, S석 50,000원",,뮤지컬,공연완료,"화요일(20:00), 수요일(16:00,20:00), 목요일 ~ 금요일(20:00), 토요일(15:00,19:00), 일요일(14:00,18:00), HOL(14:00,18:00)"
번개맨: 우주최강 번개삼총사 [거제],2023.05.27,2023.05.28,2023.05.28,"허 만, 이승리, 최하늘, 이유영, 유한비, 문윤상, 조미선 등",1시간 5분,24개월 이상,"R석 40,000원, S석 20,000원",,뮤지컬,공연완료,"토요일(11:00,14:00,16:30), 일요일(11:00,14:00)"
여신님이 보고 계셔 10th Anniversary [김해],2023.06.09,2023.06.11,2023.06.11,"성태준, 조성윤, 김기택, 윤석원, 양승리, 임준혁, 장민수 등",2시간,만 9세 이상,"R석 70,000원, S석 50,000원",,뮤지컬,공연완료,"금요일(19:30), 토요일(14:00,18:00), 일요일(14:00)"
창업 [대전],2023.06.23,2023.06.25,2023.06.25,"강민석, 곽동현, 민시윤, 최가후, 박상돈, 한상훈, 이하정 등",2시간 30분,만 7세 이상,"VIP석 66,000원, R석 55,000원, S석 40,000원",,뮤지컬,공연완료,"금요일(19:30), 토요일(19:00), 일요일(15:00), 토요일(14:00)"
영웅 [천안],2023.05.26,2023.05.28,2023.05.28,"정성화, 양준모, 민우혁, 김도형, 서영주, 최민철, 정재은 등",2시간,만 8세 이상,"VIP석 150,000원, R석 130,000원, S석 100,000원, A석 70,000원",,뮤지컬,공연완료,"금요일(19:30), 토요일(14:00,18:30), 일요일(14:00)"
영웅 [전주],2023.06.16,2023.06.18,2023.06.18,"정성화, 양준모, 민우혁, 김도형, 서영주, 최민철, 정재은 등",2시간 20분,만 7세 이상,"VIP석 150,000원, R석 130,000원, S석 99,000원, A석 77,000원",,뮤지컬,공연완료,"금요일(19:30), 토요일(14:00,19:00), 일요일(14:00)"
영웅 [고양],2023.06.02,2023.06.04,2023.06.04,"정성화, 양준모, 민우혁, 김도형, 서영주, 최민철, 정재은 등",2시간 40분,만 7세 이상,"VIP석 150,000원, R석 130,000원, S석 100,000원, A석 70,000원",,뮤지컬,공연완료,"금요일(19:30), 토요일(14:00,18:30), 일요일(14:00)"
쿠로이 저택엔 누가 살고 있을까?,2023.05.02,2023.07.23,2023.07.23,"송나영, 홍나현, 신가은, 정욱진, 황민수, 이주순, 한보라 등",1시간 50분,만 7세 이상,"R석 66,000원, S석 44,000원",,뮤지컬,공연완료,"화요일 ~ 금요일(20:00), 토요일(15:00,19:00), 일요일(14:00,18:00), HOL(14:00,18:00)"
행복한 왕자,2023.04.29,2023.06.18,2023.06.18,"양지원, 이휘종, 홍승완",1시간 20분,만 11세 이상,"R석 55,000원, S석 44,000원",,뮤지컬,공연완료,"화요일 ~ 금요일(20:00), 토요일(13:00,16:00,19:30), 일요일(14:00,18:00)"
캣츠 오리지널 내한 [대구],2023.03.31,2023.04.08,2023.04.08,"사베리오 페스쿠치, 브래들리 델라로스벨, 매튜레빅, 이안 존 버그, 페트라 일스 담, 시안 휴스, 타린 도나 등",2시간 40분,만 7세 이상,"R석 84,000원, S석 66,000원, A석 54,000원, B석 36,000원",,뮤지컬,공연완료,"화요일(19:30), 수요일(14:00,19:30), 목요일(19:30), 금요일(14:00,19:30), 토요일 ~ 일요일(14:00,19:00)"
여신님이 보고 계셔 10th Anniversary [여수],2023.06.02,2023.06.04,2023.06.04,"성태준, 조성윤, 김기택, 임진섭, 윤석원, 권동호, 한보라 등",2시간,만 10세 이상,"R석 88,000원, OP석 88,000원, S석 77,000원, A석 55,000원",,뮤지컬,공연완료,"금요일(19:30), 토요일(14:00,18:00), 일요일(14:00)"
오이디푸스,2023.04.28,2023.04.30,2023.04.30,"김경민, 김재형, 장희원, 은영호, 김다윤, 오찬우, 김정윤 등",1시간 40분,만 13세 이상,"R석 30,000원, S석 20,000원",,뮤지컬,공연완료,"금요일(20:00), 토요일 ~ 일요일(15:00)"
광주 [광주],2023.05.16,2023.05.21,2023.05.21,"김찬호, 김진욱, 박시원, 이동준, 김아영, 김태문, 원우준 등",2시간 45분,만 7세 이상,"VIP석 99,000원, R석 77,000원, S석 55,000원",,뮤지컬,공연완료,"화요일(19:30), 수요일(14:00), 목요일(14:00,19:30), 토요일 ~ 일요일(14:00,18:00), 금요일(19:30)"
베토벤: Beethoven Secret SEASON 2,2023.04.14,2023.05.15,2023.05.15,"박효신, 박은태, 조정은, 옥주현, 윤공주, 이해준, 윤소호 등",2시간 45분,만 7세 이상,"VIP석 170,000원, R석 140,000원, S석 110,000원, A석 90,000원, B석 70,000원",,뮤지컬,공연완료,"화요일(19:30), 수요일(14:30,19:30), 목요일(19:30), 금요일 ~ 일요일(14:30,19:30)"
최고다 호기심딱지 [대전],2023.06.17,2023.06.18,2023.06.18,"김원구, 박이안, 임재은, 김류하, 장효상, 이수민, 임연희 등",1시간 10분,36개월 이상,"R석 66,000원, S석 55,000원",,뮤지컬,공연완료,"토요일(11:10,14:00,16:30), 일요일(11:00,14:00)"
알쏭달쏭 캐치! 티니핑: 신비한 상자를 열어라! [안양],2023.04.29,2023.04.30,2023.04.30,"채현, 김리아, 이정훈, 문이보, 김선형, 이아영, 공귀경 등",1시간 10분,24개월 이상,"R석 66,000원, S석 44,000원",,뮤지컬,공연완료,"토요일 ~ 일요일(11:00,14:00,16:30)"
바람으로의 여행 [광주],2023.05.05,2023.05.06,2023.05.06,"김소년, 조연화, 김소정, 박두성, 윤장현, 최기원",2시간 45분,만 8세 이상,"R석 50,000원, S석 40,000원",,뮤지컬,공연완료,"금요일(18:00), 토요일(14:00,18:00)"
최고다호기심딱지 [여수],2023.05.27,2023.05.28,2023.05.28,"김원구, 박이안, 임재은, 김류하, 장효삼, 이수민, 임연희 등",1시간 10분,36개월 이상,"R석 66,000원, S석 55,000원",,뮤지컬,공연완료,"토요일(11:00,14:00,16:30), 일요일(11:00,14:00)"
틀려도 괜찮아 [남양주],2023.06.03,2023.06.06,2023.06.06,"김다솔, 송주리, 전승우, 구윤희, 고승미, 정민, 임신아 등",1시간 5분,24개월 이상,"R석 60,000원, S석 50,000원",,뮤지컬,공연완료,"화요일(11:00,14:00,16:00), 토요일 ~ 일요일(11:00,14:00,16:00)"
싯다르타 [용인],2023.04.14,2023.04.16,2023.04.16,"서도진, 이경수, 윤진웅, 송권웅, 김봄, 박수련, 최형석 등",2시간 30분,만 7세 이상,"VIP석 120,000원, R석 100,000원, S석 80,000원, A석 60,000원",,뮤지컬,공연완료,"금요일(15:00,19:30), 토요일(14:00,18:00)"
번개맨: 우주최강 번개삼총사 [부산 (앵콜)],2023.05.05,2023.05.07,2023.05.07,"허만, 이승리, 최하늘, 이유영, 유한비, 문윤상, 조미선 등",1시간 5분,24개월 이상,"R석 66,000원, S석 33,000원",,뮤지컬,공연완료,"금요일(11:00,14:00,16:30), 토요일(11:00,14:00,16:30), 일요일(11:00,14:00)"
캣츠 오리지널 내한 [대전],2023.05.19,2023.05.21,2023.05.21,"사베리오 페스쿠치, 브래들리 델라로스벨, 매튜레빅, 이안 존 버그, 페트라 일스 담, 시안 휴스, 타린 도나 등",2시간 40분,만 7세 이상,"젤리클석 170,000원, VIP석 170,000원, R석 140,000원, S석 110,000원, A석 90,000원, B석 60,000원",,뮤지컬,공연완료,"금요일(19:30), 토요일 ~ 일요일(14:00,19:00)"
캣츠 오리지널 내한 [성남],2023.05.05,2023.05.07,2023.05.07,"사베리오 페스쿠치, 브래들리 델라로스벨, 매튜레빅, 이안 존 버그, 페트라 일스 담, 시안 휴스, 타린 도나 등",2시간 40분,만 7세 이상,"젤리클석 170,000원, VIP석 170,000원, R석 140,000원, S석 110,000원, A석 90,000원, B석 60,000원",,뮤지컬,공연완료,"금요일(19:30), 토요일 ~ 일요일(14:00,19:00)"
캣츠 오리지널 내한 [수원],2023.05.12,2023.05.14,2023.05.14,"사베리오 페스쿠치, 브래들리 델라로스벨, 매튜레빅, 이안 존 버그, 페트라 일스 담, 시안 휴스, 타린 도나 등",2시간 40분,만 7세 이상,"젤리클석 170,000원, VIP석 170,000원, R석 140,000원, S석 110,000원, A석 90,000원, B석 60,000원",,뮤지컬,공연완료,"금요일(19:30), 토요일 ~ 일요일(14:00,19:00)"
캣츠 오리지널 내한 [용인],2023.05.26,2023.05.28,2023.05.28,"사베리오 페스쿠치, 브래들리 델라로스벨, 매튜레빅, 이안 존 버그, 페트라 일스 담, 시안 휴스, 타린 도나 등",2시간 40분,만 7세 이상,"젤리클석 170,000원, VIP석 170,000원, R석 140,000원, S석 110,000원, A석 80,000원",,뮤지컬,공연완료,"금요일(19:30), 토요일 ~ 일요일(14:00,19:00)"
캣츠 오리지널 내한 [진주],2023.06.02,2023.06.04,2023.06.04,"사베리오 페스쿠치, 브래들리 델라로스벨, 매튜레빅, 이안 존 버그, 페트라 일스 담, 시안 휴스, 타린 도나 등",2시간 40분,만 7세 이상,"젤리클석 170,000원, VIP석 170,000원, R석 140,000원, S석 110,000원, A석 90,000원, B석 60,000원",,뮤지컬,공연완료,"금요일(19:30), 토요일 ~ 일요일(14:00,19:00)"
라흐마니노프 [포항],2023.04.28,2023.04.29,2023.04.29,"박유덕, 유성재, 임병근, 김여랑",1시간 30분,만 7세 이상,"R석 40,000원, S석 30,000원, A석 20,000원",,뮤지컬,공연완료,"금요일(19:30), 토요일(15:00)"
빨래 [부천],2023.05.13,2023.05.14,2023.05.14,"신고은, 노희찬, 진미사, 김송이, 심우성, 안두호, 이윤성",1시간 40분,만 13세 이상,"R석 70,000원, S석 50,000원",,뮤지컬,공연완료,"토요일(14:00,18:00), 일요일(14:00)"
라흐마니노프 [부산],2023.05.05,2023.05.07,2023.05.07,"박유덕, 정욱진, 정민, 정동화, 김여랑, 조영훈",1시간 30분,만 7세 이상,"R석 77,000원, S석 55,000원",,뮤지컬,공연완료,"금요일(17:00), 토요일(15:00,19:00), 일요일(16:00)"
번개맨 : 우주최강 번개삼총사 [대구 (앵콜)],2023.04.29,2023.04.30,2023.04.30,"허만, 이승리, 최하늘, 이유영, 유한비, 문윤상, 조미선 등",1시간 5분,24개월 이상,"R석 66,000원, S석 33,000원",,뮤지컬,공연완료,"토요일(11:00,14:00,16:30), 일요일(11:00,14:00)"
알쏭달쏭 캐치! 티니핑: 신비한 상자를 열어라! [천안],2023.05.13,2023.05.14,2023.05.14,"채현, 김리아, 이정훈, 문이보, 김선형, 이아영, 공귀경 등",1시간 10분,24개월 이상,"R석 66,000원, S석 44,000원",,뮤지컬,공연완료,"토요일 ~ 일요일(11:00,14:00,16:30)"
알쏭달쏭 캐치! 티니핑: 신비한 상자를 열어라! [전주],2023.06.10,2023.06.11,2023.06.11,"채현, 김리아, 이정훈, 문이보, 김선형, 이아영, 공귀경 등",1시간 10분,24개월 이상,"R석 66,000원, S석 44,000원",,뮤지컬,공연완료,"토요일 ~ 일요일(11:00,14:00,16:30)"
